{"name":"devbuddy-database-mariadb","version":"1.0.2","kind":"database-adapter","dependencies":["devbuddy-database-core"],"permissions":["tier-2-database"],"compatibility":{"core":"1.0.1","platforms":["codex","claude-code","opencode"]},"database":{"engine":"mariadb","read_only":true,"driver":"MySqlConnector","driver_version":"2.6.2"}}
