{"name":"devbuddy-database-redis","version":"1.0.2","kind":"database-adapter","dependencies":["devbuddy-database-core"],"permissions":["tier-2-database"],"compatibility":{"core":"1.0.1","platforms":["codex","claude-code","opencode"]},"database":{"engine":"redis","read_only":true,"driver":"StackExchange.Redis","driver_version":"3.1.13"}}
