{"name":"devbuddy-database-mongodb","version":"1.0.1","kind":"database-adapter","dependencies":["devbuddy-database-core"],"permissions":["tier-2-database"],"compatibility":{"core":"1.0.1","platforms":["codex","claude-code","opencode"]},"database":{"engine":"mongodb","read_only":true,"driver":"MongoDB.Driver","driver_version":"3.11.0"}}
