{"name":"devbuddy-database-sqlserver","version":"1.0.1","kind":"database-adapter","dependencies":["devbuddy-database-core"],"permissions":["tier-2-database"],"compatibility":{"core":"1.0.1","platforms":["codex","opencode"]},"database":{"engine":"sqlserver","read_only":true,"driver":"Microsoft.Data.SqlClient","driver_version":"7.0.2"}}
