{"name":"devbuddy-database-postgresql","version":"1.0.0","kind":"database-adapter","dependencies":["devbuddy-database-core"],"permissions":["tier-2-database"],"compatibility":{"core":"1.0.0","platforms":["codex","opencode"]},"database":{"engine":"postgresql","read_only":true,"driver":"Npgsql","driver_version":"10.0.3"}}
