{
  "name": "devbuddy-database-core",
  "version": "1.0.0",
  "kind": "database-core",
  "dependencies": ["devbuddy-core"],
  "permissions": ["tier-2-database"],
  "compatibility": {"core": "1.0.0", "platforms": ["codex", "opencode"]},
  "database": {"runtime": "dotnet", "target_framework": "net10.0", "read_only": true}
}
