{"name":"devbuddy-database-oracle","version":"1.0.1","kind":"database-adapter","dependencies":["devbuddy-database-core"],"permissions":["tier-2-database"],"compatibility":{"core":"1.0.1","platforms":["codex","opencode"]},"database":{"engine":"oracle","read_only":true,"driver":"Oracle.ManagedDataAccess.Core","driver_version":"23.26.300"}}
